{
  "contract_version": 1,
  "contract_id": "PDC-TEST-001",
  "contract_status": "APPROVED",
  "approved_at": "2026-07-15T12:00:00Z",
  "approved_by": "abhillash (PM Agent OS)",
  "source_digest": "sha256:0000000000000000000000000000000000000000000000000000000000000000",
  "product_name": "Pinger",
  "problem": "Operators need a verifiable heartbeat endpoint for uptime checks.",
  "target_user": "Operators monitoring small self-hosted services.",
  "desired_outcome": "An operator can verify the service is alive with one call.",
  "scope": ["Health endpoint"],
  "out_of_scope": ["Metrics dashboards"],
  "functional_requirements": [
    {
      "id": "FR-001",
      "title": "Health endpoint",
      "description": "GET /health returns 200 with service status.",
      "capability": "health.check"
    }
  ],
  "acceptance_criteria": [
    {
      "id": "AC-001",
      "requirement": "FR-001",
      "criterion": "Given the service is running, when GET /health is called, then the response status is 200 and the body reports status \"ok\"."
    }
  ],
  "binary_release_gates": [
    {"id": "GATE-001", "description": "All acceptance criteria have executed passing tests."},
    {"id": "GATE-002", "description": "Zero blocking security findings."}
  ],
  "scored_eval_rubric": [
    {"id": "RUB-001", "criterion": "Error messages are actionable", "scale": "1-5"}
  ],
  "golden_cases": ["golden/health-basic.json"],
  "north_star_metric": "Percentage of monitored services whose outages are detected before a user reports them.",
  "leading_metrics": ["Median detection latency"],
  "guardrails": ["API error rate below 1%"],
  "non_functional_requirements": [
    {"id": "NFR-001", "category": "reliability", "requirement": "Survives process restart."}
  ],
  "known_risks": [
    {"description": "Single-process deployment has no HA story.", "level": "low"}
  ],
  "approved_product_decisions": [
    {"id": "APD-001", "decision": "Health endpoint is public (no auth)."}
  ],
  "unresolved_questions": [],
  "required_approvals": [
    {"role": "product-owner", "for": "production deployment"}
  ]
}
